,,,,,,
,AOK Baden-W체rttemberg / 22730,,,,,
,AOK Bayern Die Gesundheitskasse (intern: AOK Bayern / 22730),,,,,
,AOK Hessen / 22730,,,,,
,AOK Niedersachsen / 22730,,,,,
,AOK Nordost (intern: AOK Berlin / 22730),,,,,
,AOK PLUS (intern: AOK Sachsen / 22730),,,,,
,AOK Rheinland/Hamburg Die Gesundheitskasse (intern: AOK Rheinland / 22730),,,,,
,AOK Rheinland-Pfalz/Saarland (intern: AOK Rheinland-Pfalz / 22730),,,,,
,Audi BKK (intern: BKK Audi / 22730),,,,,
,BARMER (intern: Barmer / GEK / 22730),,,,,
,Bertelsmann BKK (intern: BKK Bertelsmann / 22730),,,,,
,BIG direkt gesund (intern: BIG Gesundheit / 22730),,,,,
,BKK EUREGIO (intern: BKK Euregio / 22730),,,,,
,BKK Linde / 22730,,,,,
,BKK Mobil Oil / 22730,,,,,
,BKK Pfalz (intern: BKK PFALZ / 22730),,,,,
,BKK VBU (intern: BKK Verkehrsbau Union / 22730),,,,,
,BKK Wirtschaft & Finanzen (intern: BKK Wirtschaft Finanzen / 22730),,,,,
,Daimler BKK/West (intern: DAIMLERCRYSLER BKK / 22730),,,,,
,DAK-Gesundheit (intern: DAK / 22730),,,,,
,Die Schwenninger Krankenkasse (intern: Schwenninger BKK / 22730),,,,,
,Heimat Krankenkasse (intern: BKK Dr. Oetker / 22730),,,,,
,HEK (intern: HEK Hanseatische Krankenk / 22730),,,,,
,hkk (intern: HKK / 22730),,,,,
,IKK Brandenburg und Berlin (intern: IKK Brandenburg Berlin / 22730),,,,,
,IKK classic (intern: IKK Sachsen / 22730),,,,,
,IKK gesund plus (Ost) (intern: IKK Sa-Anh / 22730),,,,,
,IKK S체dwest (intern: IKK S체dwest Direkt / 22730),,,,,
,KKH (intern: Kaufm채nnische Krankenkass / 22730),,,,,
,Knappschaft (allg. Verf. einschl. Minijobs) (intern: Knappschaft / 22730),,,,,
,mhplus BKK West (intern: mhplus / 22730),,,,,
,NOVITAS BKK (intern: NOVITAS Vereinigte BKK / 22730),,,,,
,pronova BKK / 22730,,,,,
,R+V Betriebskrankenkasse (intern: BKK R+V Versicherung / 22730),,,,,
,Salus BKK (intern: BKK Salus / 22730),,,,,
,SBK (intern: SBK HV West / 22730),,,,,
,SECURVITA BKK / 22730,,,,,
,SKD BKK / 22730,,,,,
,Techniker Krankenkasse / 22730,,,,,